날짜,제목,내용
 2022.08.25 09:26,"뷰노 심정지 예측 AI 프로그램, 의료급여수급권자엔 무상 제공","AI 의료기기 '뷰노메드 딥카스' 환자 지원 프로그램 가동(서울=연합뉴스) 김잔디 기자 = 의료 인공지능(AI) 솔루션 기업 뷰노는 의료급여 수급권자에게 심정지 예측 AI 의료기기 '뷰노메드 딥카스'를 무상 공급하는 환자 지원 프로그램(PAP; Patient Assistance Program)을 시행한다고 25일 밝혔다.     뷰노메드 딥카스는 일반 병동에 입원한 환자의 전자의무기록(EMR)에 담긴 활력 징후 데이터를 기반으로 심정지 발생 위험을 감시, 예측하는 AI 의료기기다. 이달 1일부터 병원에서 비급여로 사용할 수 있게 됐다.     뷰노는 현재 뷰노메드 딥카스를 사용하려면 환자가 100% 비용을 부담해야 하기 문에 환자의 소득에 따라 의료기술에 대한 접근성이 제한된다고 보고, 의료급여 수급권자에 대한 환자 지원을 결정했다고 밝혔다.     현재 의료급여 수급권자는 입원 시 발생하는 건강보험 급여 청구액 중에서 본인이 부담해야 할 비용이 거의 없지만 비급여의 경우 100% 부담해야 한다.     이예하 뷰노 대표는 ""환자 지원 프로그램은 의료 AI 업계 처음으로 시도되는 사회공헌 활동""이라며 ""'환자 중심 헬스케어'를 지향하는 뷰노의 비전에 따라 앞으로도 더 많은 환자가 AI 의료기술을 체험할 수 있도록 최선을 다하겠다""고 말했다. 뷰노메드 딥카스™ 운영화면 예시(서울=연합뉴스) 입원 환자의 심정지 발생 위험을 감시하고 예측하는 뷰노의 AI 의료기기 '뷰노메드 딥카스™' 운영화면 예시. 2022.08.25. [뷰노 제공. 재판매 및 DB 금지]    jandi@yna.co.kr"
 2022.08.03 09:30,"뷰노 개인용 심전도 측정 의료기기, 식약처 인증 획득","뷰노의 개인용 심전도 측정 의료기기 하티브 프로[뷰노 제공. 재판매 및 DB 금지]    (서울=연합뉴스) 조현영 기자 = 뷰노는 개인용 심전도 측정 의료기기 '하티브 프로'(Hativ Pro)가 식품의약품안전처 인증을 획득했다고 3일 밝혔다.     이 제품은 심전도를 측정해 데이터를 기록·저장·전송하는 의료기기다. 작고 휴대가 간편해 간단하게 심장 신호를 측정할 수 있고, 측정값을 모바일 앱으로 확인할 수 있다고 회사는 설명했다.     뷰노는 추후 부정맥 등 주요 심장질환 탐지가 가능한 가정용 인공지능(AI) 의료기기를 연이어 출시하고 AI 기반 심전도 분석 소프트웨어인 '뷰노메드 딥ECG'(VUNO Med®-DeepECG™)를 탑재할 계획이다. 또 가정용 AI 의료기기를 포함한 통합 건강관리 브랜드인 '하티브'(Hativ)를 론칭할 예정이다.    이예하 뷰노 대표는 ""앞으로 일상에서의 건강관리를 돕는 심전도 데이터 기반 의료 AI 사업을 통해 심혈관 질환으로 인한 사망률을 줄이고 미래 의료의 방향인 예방적 치료에 기여할 수 있도록 최선을 다하겠다""고 말했다.     hyun0@yna.co.kr"
 2022.08.03 09:27,"뷰노, 개인용 심전도 측정 의료기기 식약처 허가 획득","B2C 사업 본격화뷰노는 개인용 심전도 측정 의료기기 ‘하티브 프로(Hativ Pro)’에 대해 식품의약품안전처에서 인증받았다고 3일 밝혔다. 이번 인증을 시작으로 뷰노는 사업 영역을 기업소비자간거래(B2C)로 확장하고, 심전도 데이터 기반 생체신호 분야 사업을 본격화할 예정이다. 하티브 프로는 뷰노가 처음 선보인 하드웨어 의료기기다. 심전도를 측정하고, 데이터를 기록 저장 전송한다. 작고 휴대가 간편해 언제 어디서든 심장 신호를 측정할 수 있다는 설명이다. 또 측정된 신호를 연결된 모바일 앱(응용 프로그램)을 통해 확인할 수 있다.뷰노는 이번 인증 획득을 시작으로 부정맥 등 주요 심장질환을 탐지하는 가정용 인공지능(AI) 의료기기를 연이어 출시할 예정이다. 지난해 10월 식약처로부터 혁신의료기기로 지정된 AI 기반 심전도 분석 소프트웨어 ‘뷰노메드 딥ECG’를 탑재할 계획이다. 이를 통해 심전도 데이터를 활용한 의료 AI 사업을 지속적으로 강화한다는 방침이다. 이후에는 통합 브랜드인 ‘하티브(Hativ)’를 출시해, 소비자들이 일상에서 건강관리 및 만성질환을 조기 진단할 수 있도록 지원할 예정이다.  이예하 뷰노 대표는 “하티브 프로에 대한 인증으로 뷰노는 B2C 사업에 진입하게 됐다”며 “일상에서 건강관리를 돕는 심전도 데이터 기반의 의료 AI 사업을 통해, 심혈관 질환으로 인한 사망률을 줄이고 예방적 치료에 기여할 수 있도록 노력하겠다”고 말했다."
 2022.07.25 13:44,"뷰노, 7억 규모 의료인공지능 솔루션 공급계약",			 [헤럴드경제=증권부] 뷰노는 마이허브와 의료인공지능 솔루션 공급계약을 체결했다고 25일 공시했다.계약금액은 7억원으로 이는 2021년 매출 대비 31.14%에 해당하는 규모이다.계약기간은 2025년 12월 31일까지다.
 2022.07.25 13:31,"뷰노, 의료인공지능 솔루션 공급 계약 체결",			  뷰노는 주식회사 마이허브와 의료인공지능 솔루션 공급계약을 체결했다고 25일 공시했다. 계약금액은 7억원으로 최근 매출액 대비 31.14%에 해당한다.
 2022.07.21 09:29,"뷰노, AI 기반 심전도 분석 기술 국제학술지 게재",‘뷰노메드 딥ECG’에 적용 계획뷰노는 회사의 연구 결과가 심혈관 분야의 과학기술논문인용색인(SCI)급 학술지인 ‘Frontiers in Cardiovascular Medicine’에 게재됐다고 21일 밝혔다.24시간 홀터 검사로 측정된 심전도 결과(데이터)를 분석해 심방세동을 감지하는 인공지능(AI) 모델 연구다. 이번 연구는 홀터 심전도 데이터를 딥러닝 알고리즘으로 분석해 잠재된 발작성 심방세동(PAF)을 진단할 수 있는지 확인한 시험이다. 김주연 삼성서울병원 교수팀과 공동으로 진행됐다. 홀터 검사는 24시간 동안 심전도를 기록해 부정맥의 종류와 발생 빈도를 파악하는 검사다. 장시간 측정하기 때문에 축적된 데이터의 양이 많고 방해 요소(노이즈)가 포함돼 있을 가능성이 높아 분석이 어려운 것으로 알려져 있다.연구진은 딥러닝 모델을 구축하고 24시간 홀터 검사로 측정한 정상 동리듬 심전도(Normal Sinus Rhythm)를 분석했다. 이를 통해 발작성 심방세동의 숨겨진 신호를 감지할 수 있는지 확인했다. 발작성 심방세동은 동리듬 심전도가 정상적으로 유지되던 중 갑자기 불규칙한 맥박이 발생했다가 사라지는 심방세동의 한 종류다. 증상이 없고 간헐적으로 발생하기 때문에 진단이 어려운 경우가 많다고 했다.연구 결과 뷰노의 AI는 1년 내 심방세동을 진단받은 환자와 그렇지 않은 환자의 데이터를 유의미하게 구분했다는 설명이다. 향후 패치형 심전계 시장의 성장에도 기여할 것으로 기대했다. 심방세동이 뇌졸중의 주요 원인인 만큼 뇌졸중 예방 및 재발 방지에 도움이 될 것이라고도 했다. 뷰노는 이번 연구 결과를 회사의 ‘뷰노메드 딥ECG’에 적용할 계획이다. 딥러닝을 기반으로 심전도 데이터를 분석해 심부전증 심근경색증 부정맥을 검출하는 소프트웨어다. 지난해 10월 식품의약품안전처로부터 제16호 혁신의료기기로 지정됐다.이예하 뷰노 대표는 “향후 홀터 심전계는 물론 패치나 환자 감시 장치 등에도 호환할 수 있는 AI 의료기기를 선보이겠다”고 말했다.
 2022.07.12 10:41,"뷰노, 유럽 최대 영상의학회 'ECR 2022' 참가","뷰노메드 솔루션 4종 전시뷰노가 오스트리아 빈에서 개최되는 2022년 유럽 영상의학회(ECR 2022)에 참가한다고 12일 밝혔다. 이번 행사에서 뷰노는 유럽 인증을 획득한 영상의학 분야 뷰노메드 솔루션 4개 제품을 전시한다. 제품의 활용 사례와 주요 임상 연구 결과 등을 소개할 예정이다.전시 제품은 뷰노메드 흉부CT AI, 뷰노메드 본에이지, 뷰노메드 체스트 엑스레이, 뷰노메드 딥브레인 등이다. 각 제품은 인공지능(AI)을 기반으로 엑스레이 컴퓨터단층촬영(CT) 자기공명영상(MRI) 등 의료영상을 분석해 의료진의 진단을 돕는 소프트웨어다. 또 행사장 내 AI 전문 전시관인 'AIX(AI Exhibition)'에서 각국 의료 현장에서 쓰이고 있는 뷰노메드 솔루션의 활용 사례를 공유한다. 이를 통해 의료진의 워크플로우(업무흐름)를 개선하고 진단 정확도와 판독 효율을 높이는 솔루션의 장점을 전달할 예정이다. 연구 발표 세션에서는 뇌 MRI 분석 영역에 적용된 AI 기술 관련 2건의 연구 결과를 발표한다. 각 발표는 뇌 MRI 기반 치매 진행 예측 딥러닝 알고리즘의 성능과 경도인지장애 단계에서 치매로 전환될 위험을 AI 모델이 미리 예측해 환자의 조기 진단에 기여한다는 내용 등을 담고 있다.이예하 뷰노 대표는 ""ECR 2022에 참가해 뷰노메드 솔루션을 세계 의료 관계자들에게 적극적으로 소개할 예정""이라며 ""유럽 현지에서 기존 및 잠재 고객들과 직접 대면할 수 있는 기회인만큼 해외 사업 성과를 가속화할 수 있도록 최선을 다하겠다""고 말했다.ECR은 세계 영상의학과 전문의 및 의료기기 기업 관계자가 참여하는 유럽 최대 규모의 영상의학 행사다. 올해는 오스트리아 빈에서 온·오프라인으로 개최된다. 중부유럽 표준시(CET) 기준 13일부터 17일까지 진행된다."
 2022.07.05 09:10,"뷰노, 군 장병 AI·SW 역량강화 비전선포식서 의료AI 솔루션 시연","군 부대 시범적용 예정 솔루션앞줄 왼쪽부터 이종섭 국방부 장관, 이종호 과학기술정보통신부 장관, 이예하 뷰노 대표.뷰노는 군 장병 AI·SW 역량강화 사업 비전선포식에서 군 부대 시범적용 예정인 인공지능(AI) 기반 의료영상 판독 보조 솔루션을 시연했다고 5일 밝혔다.이번 사업은 과학기술 강군 육성 및 100만 디지털 인재양성을 위해 과학기술정보통신부와 국방부가 협업 추진한다. 뷰노는 이동형 엑스레이 장비에 흉부 엑스레이 판독 보조 솔루션 '뷰노메드 체스트 엑스레이'를 탑재한 제품을 시연했다. 강원도 소재 5개 군 부대에 시범 적용 예정인 제품이다. 과학기술정보통신부 산하 정보통신산업진흥원(NIPA)이 주관하는 'AI 융합 의료영상 진료·판독시스템 구축' 사업의 일환으로 개발했다. 이 제품은 별도의 차폐 시설 없이도 환자의 흉부 엑스레이 촬영이 가능하다고 했다. 인공지능을 기반으로 수 초 이내에 판독 결과를 제공해 판독 효율성과 정확도를 높인다는 설명이다. 또 격오지를 중심으로 현장 의료서비스가 가능하도록 설계돼, 의료 환경(인프라)이 낙후한 지역에서도 진단 편차를 줄이고 의료진의 진단을 도울 수 있을 것으로 기대 중이다. 군 관계자는 ""군 병원 시범 적용 절차가 예정돼 있는 만큼, 인공지능 의료기기가 향후 군 의료 체계 전반에서 판독 효율성과 정확도를 향상시키는 데 기여할 것으로 기대된다""고 말했다.이예하 뷰노 대표는 ""뷰노메드 체스트 엑스레이가 적용된 제품 패키지를 선보일 수 있어 기쁘다""며 ""추후에도 군에 최적화된 인공지능 의료기기를 개발해 국가를 위해 헌신하는 군 장병의 건강증진과 군 보건의료 향상에 일조할 수 있도록 최선을 다하겠다""고 했다."
