날짜,제목,내용
 2023.05.27 06:01,‘엔비디아 효과’ 누리는 AI 수혜주… 루닛·한미반도체주가 ‘날개’,"			         반도체 장비 업체 한미반도체와 의료 인공지능(AI) 전문 기업 루닛 주가가 고공 행진하고 있다. 세계 1위 그래픽 처리장치(GPU) 생산 기업 엔비디아가 깜짝 실적을 발표한 이후 AI 관련주가 주목받은 것이다.27일 한국거래소에 따르면 한미반도체와 루닛의 지난 석달 주가 수익률은 각각 72.2%, 78.8%에 달했다. 지난 6개월 간 주가 상승률도 각각 110%, 173%에 이른다.이들 두 종목은 엔비디아 관련주로 주목받고 있다. 전문가들은 엔비디아의 오픈AI가 불러온 ‘생성형 AI’는 ‘제 2의 www’가 될 가능성이 크다고 전망하고 있는데 국내 기업 중 한미반도체와 루닛이 관련 사업을 추진하고 있기 때문이다.루닛 제품./루닛 제공        루닛은 AI 영상분석 솔루션 ‘루닛 인사이트’와 AI 바이오마커 플랫폼 ‘루닛 스코프’ 등을 통해 전 세계에서 매출을 거둬들이고 있다. AI 헬스케어 기업 최초로 분기 매출 100억원을 달성한 루닛은 지난 26일, 주가가 8만4000원을 돌파하며 장중 최고가를 기록했다. 시가총액은 1조원에 이른다. 지난 2019년 2억원 수준이던 루닛의 연간 매출액은 지난해 139억원으로 늘었다. 올해 1분기 매출 규모는 110억원으로 이미 지난해 연간 매출액의 80%에 이른다.지난해 7월 코스닥 시장에 상장한 루닛은 적자에 따른 실적 부담, 유통가능물량 우려 등으로 공모가 희망범위 하단인 4만4000원보다 훨씬 낮은 3만원으로 결정되는 등 흥행에 참패했다. 이후 금리 인상, 투심 악화 등으로 인해 지난해 10월 주가는 1만89000원까지 내려앉았다. 하지만 올초 생성형 AI ‘챗GPT’가 급부상하면서 의료 AI 분야가 함께 주목 받았고, 루닛 주가도 반등했다.증권가에서는 루닛이 꾸준히 성장할 것으로 기대하고 있다. 한송협 대신증권 연구원은 “아직 시장 초기 단계라 매출 발생에 대한 불확실성은 존재한다”면서도 “글로벌 의료 AI 시장의 성장성과 루닛의 경쟁력을 감안하면 중∙장기적인 외형 성장은 지속될 것”이라고 봤다. 강하나 이베스트투자증권 연구원은 “이제 AI는 헬스케어 부문에서 필수가 되고 있다는 점이 시장의 주목을 받고 있는 이유”라면서 “루닛 등 국내 AI 의료 업체들은 글로벌 대형사들과의 협업 및 계약증가로 글로벌 역량을 쌓아가고 있다”고 설명했다.한미반도체는 AI 반도체 성장주로 주목받고 있다. 글로벌 투자은행(IB) 모건스탠리는 “AI가 메모리 반도체 업계에 미치는 영향을 과소평가하고 있다고”고 봤다. AI 서버는 메모리 용량이 기존보다 약 2배 이상 높아 메모리 반도체 수요를 크게 증가시킬 수 있다는 점을 이유로 꼽았다.특히 한미반도체는 전 세계 반도체 업황 부진으로 1분기 어닝쇼크를 기록했지만, 반도체 업황이 반등할 것이라는 기대로 주가는 오히려 상승했다. 도현우 NH투자증권 연구원은 “급증하는 AI 반도체 수요로 고대역폭메모리(HBM) 증설 장비 투자가 늘고 있다”며 “한미반도체는 반도체 칩을 붙여주는 TC본더 장비를 제조하고 있어 영향이 있을 것”이라고 판단했다.엔비디아의 경우 고성능 AI에 필요한 GPU 및 AI 반도체를 생산하는데, 관련 산업 성장에 따라 헬스케어와 반도체 부문도 주목받을 것이란 전망이다. 전일 엔비디아는 장 마감 후 예상치를 웃도는 실적을 내놨다. 엔비디아는 2분기 매출이 110억달러에 이를 것으로 예상했는데, 이는 시장 예상치(72억달러)를 훨씬 웃돈 수치다. 엔비디아의 시장 가치도 1조달러(1330조원)에 육박했다. 25일(현지 시각) 뉴욕증시에서 엔비디아 주가는 전 거래일보다 24.37% 급등한 379.80달러(50만5134원)에 거래를 마쳤다.AI 반도체 대장주인 엔비디아 급등에 따라 국내 관련주도 상승 흐름을 이어갈 것이라는 관측이다. 증권가 한 관계자는 “엔비디아는 AI 수혜주로 꼽히며 올들어 주가가 2배 가까이 뛰었는데, 국내에서 삼성전자와 하이닉스 외 관련 소재·부품·장비(소부장) 반도체 기업 뿐 아니라 의료 AI 우등 기업도 시장에서 주목을 받을 것”이라고 전망했다."
 2023.05.24 18:51,"[데이터로 보는 증시]엘앤에프·루닛, 기관·외국인 코스닥 순매수 1위(5월 24일-최종치)","			 [서울경제] 24일 코스닥지수는 전일보다 3.70포인트(0.43%)하락한 855.46으로 거래를 마쳤다.투자자별로는 개인이 2303억 원어치를 순매수했고 외국인과 기관은 각각 1490억 원, 742억 원어치를 팔았다.기관은 순매수 상위종목은 엘앤에프(066970)(48억원)와 ISC(095340)(43억원), 메디톡스(086900)(37억원), 티앤엘(340570)(21억원), 비에이치(090460)(21억원), 휴비츠(065510)(20억원), 인크로스(20억원), 씨앤씨인터내셔널(15억원), KH바텍(14억원), 에스티팜(13억원)등을 매수한 반면 에코프로비엠(209억원)을 비롯해 JYP Ent.(51억원), 동진쎄미켐(005290)(46억원), 셀트리온헬스케어(46억원), 와이지엔터테인먼트(122870)(41억원), 서진시스템(178320)(32억원), 바이오니아(29억원), 넥슨게임즈(28억원), 에스엠(25억원), 루닛(328130)(25억원)등을 팔았다. 외국인은 루닛(78억원)를 비롯해 동진쎄미켐(54억원), 와이지엔터테인먼트(48억원), 성우하이텍(015750)(45억원), 서진시스템(29억원), 클래시스(214150)(25억원), 이오플로우(24억원), 파마리서치(24억원), 심텍(22억원), 씨유박스(21억원)등 순매수했다. 순매도 상위종목은 에코프로(296억원)와 에코프로비엠(235억원), 기가비스(165억원), 엘앤에프(116억원), 포스코DX(94억원), 알테오젠(90억원), HLB(66억원), 메디톡스(49억원), 바이오니아(48억원), 에스엠(45억원)등을 팔았다."
 2023.05.24 14:44,"디지털 헬스케어도 이제 '유니콘' 시대…루닛, 장중 1조 돌파","장중 최고가 8만1200원'유니콘 기준' 시총 1조원 돌파한때 공모가 반토막났지만AI 의료의 힘으로 유니콘 목전국내에서도 디지털 헬스케어 기업 중 유니콘기업(거대신생기업)의 탄생이 눈앞으로 다가왔다. 주인공은 최근 인공지능(AI)를 통한 암 정복을 내건 루닛이다. 유니콘기업은 비상장기업을 대상으로 한다는 점에서 엄밀한 유니콘은 아니지만 디지털 헬스케어에서도 처음으로 이 기준을 달성했다는 점에서 의미가 있다는 평가다.[사진제공=루닛]24일 한국거래소에 따르면 이날 루닛의 주가는 장중 한때 8만1200원까지 치솟았다. 루닛의 상장 주식수가 총 1234만654주인 점을 고려하면 루닛의 주가가 8만1100원을 넘어서면 유니콘 기준인 시총 1조원을 돌파하게 된다. 덩달아 전날 증권사 중 처음으로 루닛의 목표 주가를 제시하면서 무로 13만7000원으로 설정한 보고서가 나오기도 했다. 다만 유니콘 기준 돌파 후 매도세가 이어지며 오후 2시40분 현재 루닛 주식은 8만원 내외에 거래되고 있다. 루닛의 장중 유니콘 돌파는 지난해 7월 상장후 약 10개월 만이다. 당시 유통가능물량에 대한 우려와 지속적인 영업 손실 등에 따른 실적 부담 등을 이유로 공모가 희망범위 하단인 4만4000원 대비 대폭 낮은 3만원으로 공모가가 정해졌다. 이후로도 투심이 얼어붙으면서 지난해 10월에는 상장 석달만에 주가가 절반 수준인 1만8900원까지 떨어지기도 했다. 하지만 이후 글로벌 투자 심리가 다시 회복세로 돌아선 가운데 올해 초 생성형 AI '챗GPT'의 부상과 함께 의료AI 분야가 덩달아 주목 받으면서 최근 주가 흐름이 꾸준히 상승세를 이어오고 있다. 실적 면에서도 올해 1분기 분기 최대인 109억7100만원의 매출을 기록하면서 영업손실도 23억원으로 대폭 줄이는 데 성공했다. 전년 동기 대비 매출은 268.6% 늘었고, 영업손실은 82% 줄었다. 특히 매출 면에서 지난해 전체 매출 139억원의 79%를 올해 1분기에 달성했다. 루닛은 사업 축으로 내걸고 있는 암 진단 솔루션 '루닛 인사이트'와 암 치료 결정 솔루션 '루닛 스코프'가 성장하며 매출이 증가했다고 전했다. 특히 해외 매출의 비중과 증가세가 두드러진다. 1분기 해외 매출은 97억2000만원으로 전년 동기 대비 273.4% 늘었다. 지난 3월 말 기준 루닛 인사이트 제품을 사용하는 의료기관도 전 세계 2000곳을 돌파했다. 지난해 10월 1000곳 돌파 이후 약 5개월 만에 도입기관을 2배 이상 늘리는 데 성공했다. 루닛 스코프도 미국 바이오헬스케어 기업 가던트헬스와의 협업으로 완성한 암 치료 분야 첫 제품을 지난 2월 글로벌 시장에 출시한 바 있다.이에 더해 지난 12일에는 모건스탠리 캐피털인터내셔널(MSCI) 글로벌 소형주(스몰캡) 지수에 편입되면서 매수세가 강화된 것으로 분석된다. 매년 2월, 5월, 8월, 11월마다 발표되는 편출입 목록에서 루닛은 이번 5월 발표를 통해 글로벌 스몰캡 기업으로 편입됐다. 발표에 따른 정식 종목교체일은 오는 31일이지만 이에 대비한 예비 매수세가 가세한 것도 최근 주가 상승에 영향을 미친 것으로 보인다.정재원 신한투자증권 연구원은 ""최근 루닛의 주가가 급등했지만 여전히 글로벌 경쟁상대(피어) 대비 저평가됐다고 판단한다""며 ""회사가 보여주는 성과와 디지털헬스케어라는 주제에 대한 관심도, 여전히 낮은 밸류에 주목한다""고 분석했다. 루닛은 다음달 미국 시카고에서 열리는 미국종양학회(ASCO)에서도 전 세계 ASCO 참가 의료 AI 기업 중 가장 많은 16편의 연구초록을 발표할 예정이다."
 2023.05.23 18:26,"서범석 루닛 대표 ""청진기 대신 AI…암 정복 앞당기겠다""",[서경 인베스트 포럼 2023]헬스케어 AI산업 급성장 필연지난해 매출액 3년 전의 70배서범석 루닛 대표가 23일 서울 중구 신라호텔 영빈관에서 열린 ‘제9회 서경 인베스트 포럼’에서 AI 의료 진단 산업 성장 전망을 주제로 발표하고 있다. 오승현 기자[서울경제] “의료 행위는 기본적으로 데이터에 기반합니다. 과거 의사들이 청진기 하나로 판단했지만 이제는 인공지능(AI) 기술로 분석한 빅데이터 패턴으로 진료할 수 있게 됐습니다.”1세대 의료 AI 기업 루닛(328130)의 서범석 대표는 23일 서울 신라호텔에서 ‘혁신과 성장을 위한 M&A 시장 활성화’를 주제로 열린 제9회 서경 인베스트 포럼에서 “암은 수천·수만 종류가 있는 복잡한 질병이기에 AI 의료 데이터 분석이 진단과 치료를 정확하게 만들어 줄 수 있다”며 이같이 설명했다. 서 대표는 의료 기술의 고도화로 의사와 환자들이 접할 수 있는 데이터가 복잡해질수록 AI를 활용한 치료 접근이 필수적이고 이에 따라 헬스케어 AI 산업은 급속도로 성장할 수밖에 없다고 덧붙였다. 업계에서는 글로벌 의료 AI 시장이 매년 50% 이상 성장해 2025년 약 40조 원에 이를 것으로 전망하고 있다.카이스트 석·박사 연구 인력 6명이 모여 2002년 설립한 루닛은 국내 스타트업 중 최초로 딥러닝 기술을 활용한 AI 의료 솔루션을 개발했다. AI 의료 솔루션은 자기공명영상장치(MRI) 등으로 얻은 영상 정보를 암 세포 발견과 같은 의료 정보로 가공해 의사의 진료 판단을 돕는 프로그램이다. 루닛은 지난해 7월 기술특례 전형을 이용해 코스닥 시장에 상장했고 2곳의 기관에서 모두 기술 등급 ‘AA’를 받았다. 역대 헬스케어 기업들이 받은 등급 중 가장 높은 수준이다.서 대표는 AI를 활용한 암 정복 가능성에 대해서도 언급했다. 그는 “우리는 AI 기술로 가장 흔하면서도 사망률이 높은 폐암과 유방암 진단·치료에 집중하고 있다”며 “AI는 영상을 픽셀(디지털 화면의 가장 작은 단위) 단위로 분석하기에 인간 전문의보다 영상 판독 정확도가 월등히 높다”고 말했다.2019년 2억 원에 불과했던 루닛의 매출은 혁신적 기술을 바탕으로 지난해 139억 원으로 늘었다. 올 1분기 매출은 110억 원으로 이미 지난해 매출의 약 80%를 달성했다. 서 대표는 성장 비결에 대해 “암 등의 질병을 AI로 해결하기 위한 목표를 위해 많은 노력을 기울인 것이 주효했다”고 설명했다.그는 사업 초창기 엑스레이(X-ray) 장비 등 영상 의료기기를 만드는 해외 기업과 적극적으로 파트너십을 맺은 전략도 성공적이었다고 자평했다. 서 대표는 “창립 초기부터 글로벌한 회사가 되기 위해 노력했고 회사 임직원의 20%가량이 해외 출신”이라고 강조했다. 또 상장 전 유치한 투자금 1590억 원 중 60%(950억 원)가 해외 자금이다.서 대표는 “GE헬스케어·후지필름 등 글로벌 기업과 파트너십을 맺고 있으며 파트너사들의 엑스레이 시장 점유율만 50%에 달한다”며 “현재 루닛은 파트너사 점유율의 약 2%를 (매출원으로) 확보했다. 향후 잠재 시장에서의 대규모 매출 성장을 이룰 것”이라고 기대했다.
 2023.05.23 16:14,"루닛, 기업가치 7달새 4배로…수요예측 부진 씻고 반전 스토리 썼다","23일 장중 52주 신고가 기록…지난해 10월 신저가 대비 400% 이상 상승작년 7월 수요예측서 한자릿수 경쟁률 부진…반년 여만에 깜짝 반전해외수출 기반 실적고공 행진 속 글로벌 학회 발표 통한 인지도 제고 순항의료 인공지능(AI) 기업 루닛의 기업가치가 최근 7개월 새 4배 가량 급등했다. 지난해 여름 부진했던 수요예측과 상반된 주가 흐름을 이어가는 중이다. 이 회사가 시장 내 선도적 입지를 기반으로 꾸준한 실적 성장과 연구성과를 잇따라 내놓고 있는 만큼, 기대치를 한껏 낮춘 당시 분위기가 오히려 기회로 작용했다는 분석이다. 23일 한국거래소에 따르면 이날 루닛의 주가는 전일 대비 4.37% 오른 7만1700원으로 장을 마감했다. 특히 장중에는 52주 신고가(7만5900원)을 기록하며, 지난해 10월 장중 기록했던 52주 신저가(1만8900원) 대비 4배 가량 높은 주가에 도달했다. 지난해 7월 코스닥에 입성한 루닛의 상장 과정은 순탄치 않았다. 상장을 앞두고 실시한 기관 수요예측에서 7.1대 1의 경쟁률에 그치며 당초 희망밴드 최하단(4만9000원) 대비 30% 이상 낮은 3만원에 공모가를 확정했다. 일반청약 경쟁률 역시 9:1로 한자릿수대 경쟁률에 머물며 부진했다. 루닛은 상장 전부터 다수 글로벌 논문 발표와 GE헬스케어, 필립스 등 굵직한 글로벌 기업과 협업으로 기업공개(IPO) 최대어 중 하나로 꼽혀왔다. 때문에 시장 기대에 크게 미치지 못하는 성적표였다. 상장 당일엔 상한가를 기록했지만, 이후 하락이 지속돼 10월 주가는 2만원 아래로 떨어졌다. 미국발 금리인상과 글로벌 경기침체에 얼어붙은 당시 투심이 고스란히 반영된 탓이다.  루닛 기업가치는 지난해 4분기 증시 회복 기류와 함께 고개를 들기 시작했다. 회사가 꾸준한 해외 학회 활동 등을 통해 글로벌 시장 영향력을 강화하는 한편, 실적까지 뒷받침되면서 저가매수 수요가 몰린 것으로 풀이된다. 단기 급등기업 목표주가 제시에 신중한 증권사 보고서 조차 이날 13만7000원의 목표가를 내놓을 만큼 분위기가 달라졌다. 루닛은 AI 영상분석 솔루션 '루닛 인사이트'와 AI 바이오마커 플랫폼 '루닛 스코프'를 통해 매출을 거둬들이고 있다. 특히 핵심 매출원인 루닛 인사이트는 지난해 4월 출시 4년여 만에 전세계 도입 의료기관 2000개를 돌파했다. 1000개 돌파 시점 5개월만에 이뤄진 가파른 속도다. 특히 주요 매출이 해외에서 이뤄졌다는 점이 긍정적이다. 내수 시장에서 안정적인 점유율과 매출을 확보한 뒤 순차적으로 해외 진출하는 방식 보다 성장 속도가 빠를 수 밖에 없다. 실제로 루닛 인사이트 도입 의료기관 중 84% 가량이 해외 고객이다. 최근에는 해외 파병군과 격오지 부대 의료기관으로 루닛인사이트 공급 지역을 확대하며 추가 신규시장 기대감도 커졌다. 이에  2019년 2억원에 불과했던 루닛의 연간 매출액은 2021년 66억원, 지난해 139억원으로 급증했다. 올 1분기에는 전년 동기 대비 269% 증가한 110억원의 매출액을 기록했다. 지난해 전체 매출의 80%에 달하는 액수다. 1분기 역시 매출의 88.6%를 수출로 거둬들인 루닛의 올해 매출액 전망치는 391억원 수준이다.  정재원 신한투자증권 연구원은 ""루닛은 글로벌 사업 확장을 기반으로 한분기만에 지난해 전체 매출의 79%를 달성해 성장세를 증명했다""며 ""루닛스코프는 다수 학회 참석을 통한 데이터 확보로 다양한 암종에 대한 가능성을 지속적으로 확인 중이다. 비록 AI 기반 바이오마커가 구체적 성과를 보인 사례는 없었지만, 활용 시도가 늘고 있어 긍정적이다""고 분석했다. 업계는 루닛의 또 다른 강점으로 눈에 보이는 실적이 아닌 해외 무대에서의 인정을 꼽는다. 루닛은 지난 4월 미국암학회에서 딥러닝 모델을 비롯한 4건의 연구결과를 발표한데 이어 내달 2일부터 6일까지 미국 시카고에서 열리는 미국 임상종양학회(ASCO)에서 연구초록 16편을 발표한다. 행사에 참여하는 전세계 의료AI 기업은 물론, 국내사를 통틀어 가장 많은 수다. 앞서 1월엔 '다보스포럼'으로 알려진 세계경제포럼(WEF) 글로벌 이노베이터 기업으로 선정돼 공식 초청을 받기도 했다. 이 회사는 2020년 세계경제포럼이 선정한 유망 초기 스타트업 중 한국 기업으로는 유일하게 선정된 바 있다. 2018년 21억달러(약 2조7600억원)에서 2025년 362억달러(약 47조4800억원)까지 시장 성장이 전망되는 의료 AI 분야 선두주자 입지를 굳혔다는 평가다.  진단 보조부터 바이오마커 발굴까지 이어진 기술 징검다리를 기반으로 한 치료제 개발도 초석을 다진 상태다. 현재 다수 국내 바이벤처 및 국내외 대학병원들과 신약 개발 파트너십을 맺고 있다. 개발 파트너가 항암 신약 후보물질을 발굴하면 루닛 AI 기술을 활용해 바이오마커를 찾아내는 식이다. 면역항암제와 바이오마커 동반진단 모델로 인허가를 획득한다는 목표다. "
 2023.05.19 09:16,"루닛, 1분기 어닝 서프라이즈…올해 이익실현 가능할까","분기 매출 110억…“글로벌 의료AI업계에서도 드문 수치”도입 의료기관 5개월 만에 2배…해외 매출 급증·비용 절감내부적으로는 ‘연매출 280억·2025년 BEP 도달’ 예상 유지이 기사는 2023년05월15일 09시15분에 팜이데일리 프리미엄 콘텐츠로 선공개 되었습니다.[이데일리 김새미 기자] 루닛(328130)이 1분기 매출 110억원, 영업손실 24억원으로 예상치(매출 57억원, 영업손실 117억원)를 상회하는 ‘어닝 서프라이즈’ 실적을 기록했다. 예상보다 빠르게 매출이 증가하면서 연매출이 올해 목표치인 280억원을 넘을 수 있겠다는 분석도 나온다.서범석 루닛 대표 (사진=루닛)14일 루닛의 1분기 보고서에 따르면 루닛은 연결재무제표 기준 매출은 110억원으로 전년 동기 대비 268.6% 급증했다. 같은 기간 영업손실은 134억원에서 24억원으로 82.2% 급감하고, 순손실도 21억원으로 90.4% 줄었다.이처럼 적자폭이 급감한 데에는 해외 판매 증가로 분기 최대 실적을 이룬 동시에 인건비와 연구개발비 등 비용을 감소시킨 게 주효했다. 박종현 다올투자증권 연구원은 “영업비용 측면에선 인건비와 연구개발비가 각각 전년 대비 18%, 53% 감소하며 적자 폭을 크게 개선했다”고 말했다.루닛의 분기 최대 매출에는 해외 판매 증가가 견인했다. 루닛의 1분기 해외 매출은 97억원으로 전년 동기(26억원) 대비 273.4% 급증했다. 같은 기간 국내 매출도 4억원에서 13억원으로 235.4% 늘었다. 1분기 해외 매출 비중은 전체의 88.6%에 달한다.품목별로 살펴보면 인공지능(AI) 영상분석 솔루션 ‘루닛인사이트(Lunit INSIGHT)’의 약진이 눈에 띈다. 루닛은 루닛 인사이트로만 작년 매출(139억원)의 45%(62억원)를 거뒀다. 지난해 루닛 인사이트 매출(98억원)의 63.5%에 해당하는 규모다. 루닛 인사이트는 지난해 매출이 98억원으로 전년(38억원)의 3배 가까이 급증했다. 이러한 추세대로라면 올해도 루닛인사이트 매출이 적어도 2배 이상 성장할 것으로 기대된다.연구용으로 판매 중인 AI 바이오마커 플랫폼 ‘루닛 스코프(Lunit SCOPE)’도 1분기 매출이 47억원으로 지난해 매출(40억원)을 돌파했다. 루닛스코프는 이번 분기에 전체 매출의 42.8%를 차지하면서 루닛인사이트(42.3%) 못지 않게 매출에 기여했다. 미국 바이오헬스케어 기업 가던트헬스(Guardant Health)로부터 마일스톤을 수취한 효과가 컸을 것으로 풀이된다.시장에서는 루닛의 매출이 이러한 추세로 증가한다면 올해 연매출이 예상치인 280억원을 가뿐하게 넘길 것이라는 분석도 나오고 있다. 특히 영업손실과 순손실이 20억원대로 줄면서 시장에선 2025년으로 예상했던 손익분기점(BEP) 도달 시점이 연내로 앞당겨질 것이라는 기대감도 싹트고 있다.루닛 내부에서는 이러한 전망에도 손익분기점 도달 예상 시기와 목표 매출을 기존 방침대로 유지하는 등 보수적인 입장을 내비치고 있다. 고객사인 의료기관이 루닛의 서비스를 연간 단위로 구매하기 때문에 구매 시기가 연말연초인 1분기와 4분기에 쏠리는 경향이 있기 때문이다.실제로 루닛 인사이트 도입 국내외 의료기관 수는 지난해 10월 1000곳에서 지난 3월 말 2000곳으로 급증했다. 연말~연초 기간에 도입 의료기관 수가 2배 이상 늘었던 만큼 2~3분기에도 빠른 증가 속도를 유지할 수 있을지는 미지수다.반면 판매관리비는 어느 분기에나 비슷한 수준을 유지하기 때문에 수익성 지표가 2분기에는 악화될 우려도 있다. 루닛의 지난해 분기별 매출액 추이를 살펴보면 1분기 30억원→2분기 25억원→3분기 44억원→4분기 39억원으로 들쭉날쭉하다. 판매관리비는 140억~170억원대로 유지되면서 영업손실율도 446.7%→548%→222.7%→351.3% 순으로 오르내렸다.그럼에도 루닛의 실적 개선 속도에 대해서는 업계 안팎에서 놀라워하는 분위기다. 박 연구원은 “루닛이 1분기 매출액 110억원을 달성했다”며 “지난해 전체 매출액이 138억원이었다는 점을 감안하면 놀라운 매출”이라고 언급했다. 이는 글로벌 의료AI업계에서도 쉽게 볼 수 없는 매출이라는 게 서범석 루닛 대표의 설명이다. 서 대표는 “루닛이 글로벌 의료AI 업계에서 흔히 찾아볼 수 없는 분기 매출 100억원을 올해 1분기에 처음 기록했다”고 강조했다.루닛은 활발한 해외 진출로 실적 개선에 박차를 가할 전망이다. 특히 서 대표가 루닛을 해외에 적극적으로 알리기 위해 발로 뛰고 있다는 전언이다. 서 대표는 올해 다보스포럼으로 유명한 세계경제포럼(WEF)과 세계 최대 제약·바이오 투자 행사인 JP모건 헬스케어 콘퍼런스 등 국제 행사에 적극 참여했다. 뿐만 아니라 11일에는 CNBC에 출연해 의료AI 사업에 대해 소개했다.서범석 루닛 대표는 11일 CNBC에 출연했다. (사진=CNBC)루닛 관계자는 “올해도 글로벌 의료기기 기업과의 파트너십을 더욱 강화해 루닛 인사이트 제품 시장점유율을 넓혀나가는 한편, 글로벌 빅파마와 루닛 스코프를 활용한 공동연구를 본격화하기 위해 노력할 계획”이라고 말했다."
