날짜,제목,내용
 2022.07.05 09:00,"셀바스AI, 하나금융파인드 플랫폼서 '셀비 체크업' 서비스","			 [이데일리 김응태 기자] 셀바스AI(108860)는 질병 예측 솔루션 ‘셀비 체크업(Selvy Checkup)’이 하나금융파인드의 인슈어테크 플랫폼 핑글 내 ‘핑글헬스’로 서비스된다고 5일 밝혔다.셀비 체크업의 하나금융파인트 ‘핑글’ 서비스 적용 화면. (사진=셀바스AI)셀비 체크업은 사용자의 건강검진 정보를 기반으로 주요 질환에 대한 발병 위험도를 예측해주는 솔루션이다. 실제 데이터를 기반으로 만들어진 인공지능 학습 모델을 활용해 높은 수준의 예측도를 보유하고 있다.셀바스AI는 셀비 체크업을 하나금융파인드 인슈어테크 플랫폼 ‘핑글’에서 서비스하기로 했다. 핑글헬스 서비스를 이용하면 개인 건강검진 결과를 기반으로 생활습관 병과 6대암을 포함한 주요 질환 10개의 4년 내 발형 위험을 예측 및 분석할 수 있다. 건강 상태를 다각도로 분석한 리포트 제공은 물론, 주요 질환에 대한 연령별 기존 발병자와의 건강수치를 비교해 개선 방법도 알려준다.윤상원 셀바스AI 헬스케어부문 사업대표는 “최근 국내 금융, 보험사 등의 서비스는 금융 상품 추천, 보장분석뿐 아니라 차별화된 개인 맞춤형 서비스로 진화 중”이라며 “셀비 체크업은 이미 온·오프라인 다양한 서비스 적용을 통해 소비자 중심, 개인에게 가장 밀접한 맞춤형 건강관리 서비스로 자리매김하고 있다”고 말했다."
 2022.09.06 10:10,투비소프트 자회사 투비디티엑스 블론드그룹아시아와 업무협약 체결,"투비디티엑스 기립성 저혈압 진단 모듈 북미 시장 진출 계기 마련[왼쪽부터 블론드그룹아시아 피에르 블론드 대표, 투비디티엑스 김동윤 대표]디지털 헬스케어 전문기업 투비디티엑스(대표 김동윤)와 캐나다 블론드그룹아시아유한법인(대표 피에르 블론드)이 디지털 헬스케어 제품 공급과 관련해 전략적 업무제휴를 지난달 29일 롯데시티 호텔 마포에서 맺었다.이번 협약으로 투비디티엑스가 개발한 기립성 저혈압 진단 모듈이 탑재된 건강 관리 시스템을 블론드그룹아시아가 북미에서 마케팅·유통·판매·네트워크 확장 등의 사업을 전개하는데 활용하게 된다.블론드그룹아시아는 캐나다에 본사를 둔 의료기기 유통·판매 전문 기업으로 2021년과 2022년 초에 국내기업의 니트릴장갑과 150억 원 상당의 코로나 테스트 키트를 퀘백 주정부 병원에 공급했다.투비디티엑스는 국내 개발 툴 1위 기업 투비소프트에서 AI기반 기립성저혈압 진단플랫폼과 기립성 저혈압 디지털 치료제 사업화를 위해 서울 홍릉강소연구개발특구에 설립한 자회사다.블론드그룹아시아 피에르 블론드 대표는 “투비디티엑스의 우수한 기술과 제품을 북미에 공급할 수 있어 기쁘다”며 “투비디티엑스 기술과 제품이 현지에서 관심을 보일 것이라며, 널리 보급될 수 있도록 힘쓰겠다”고 말했다.김동윤 투비디티엑스 대표는 “투비디티엑스 기립성 저혈압 진단 모듈은 국내외 누구나 사용할 수 있어서 복지가 우수한 북미에서도 충분히 관심을 보일 만하다”며 “이번 업무협약으로 투비디티엑스가 세계로 사업을 넓힐 수 있는 중요한 발판이 될 것이다”라고 말했다."
 2022.09.01 17:44,"투비소프트, 9.9억 규모 유상증자 결정","			 [이데일리 이정현 기자] 투비소프트(079970)는 운영자금 9억9999만9660원 조달을 위해 정규남, 박성영, 구명완, 신진우 씨와 에이젯에셋투자조합을 대상으로 제3자배정증자 유상증자를 결정했다고 1일 공시했다. 보통주 110만4972주가 발행되며 발행가액은 905원이다. 신주 상장예정일은 10월5일이다."
 2022.08.23 19:12,댄스스포츠연맹 · 투비소프트 댄스스포츠 산업 발전을 위한 업무협약,"- 댄스 콘텐츠 · 안무저작권 저변 확대에 공동 협력대한민국댄스스포츠연맹(회장 강일성)과 투비소프트(사장 이임찬)가 11일 댄스스포츠 산업 발전과 경쟁력 제고를 위해 업무협약을 체결했다. <사진설명 = 왼쪽부터 강일성 대한민국댄스스포츠연맹 회장, 이임찬 투비소프트 사장, 사진제공 투비소프트> 대한민국댄스스포츠연맹은 지난해 12월 국제올림픽위원회(IOC)에 올림픽 정식 종목으로 채택된 브레이킹 및 스탠다드, 라틴 등 각종 댄스 종목을 주관하는 대한체육회 회원 종목 단체이다.투비소프트는 제스처 AI 인식 기술을 토대로 안무저작권 보호를 위한 사업 등으로 창작 안무 생태계 조성에 힘쓰고 있다.이번 협약으로 대한민국댄스스포츠연맹은 댄스 콘텐츠와 안무저작권 저변 확대를 위한 파트너십 · 네트워크 확장 등에 협력하기로 약속했다.투비소프트는 안무 인식 AI 기술개발 · 유통, NFT 발행, 안무저작권 보호와 활성화를 위한 환경 조성에 협력하기로 했다.강일성 회장은 “투비소프트와 업무 협약을 맺어 댄스와 AI 기술의 새로운 장을 펼칠 기회를 맞이했다”며 “연맹은 댄스스포츠 발전을 위한 다양한 방법을 지속적으로 고민해 국제대회에서 좋은 성적을 거두고, 댄스로 소통하고 화합해 즐기는 문화를 조성하는 데 보탬이 되겠다”고 말했다.이임찬 사장은 “대한민국댄스스포츠연맹은 안무저작권 보호와 활성화를 위한 최고의 파트너”라며 “이번 업무협약으로 투비소프트는 안무 인식 AI 기술 개발에 더욱 박차를 가해 국내 댄스스포츠 산업 발전에 새로운 길을 여는 계기를 만들겠다”고 말했다."
 2022.08.23 15:01,"대한민국댄스스포츠연맹·투비소프트, 댄스스포츠 산업 발전 협약","◆…강일성 대한민국댄스스포츠연맹 회장(왼쪽)과 이임찬 투비소프트 사장이 지난 11일 댄스스포츠 산업 발전과 경쟁력 제고 업무협약을 맺고 기념촬영을 하고 있다. 사진=투비소프트 제공투비소프트가 지난 11일 대한민국댄스스포츠연맹과 '댄스스포츠 산업 발전과 경쟁력 제고를 위한 업무협약'을 맺었다고 23일 밝혔다.   대한민국댄스스포츠연맹은 지난해 12월 국제올림픽위원회(IOC)에 올림픽 정식 종목으로 채택된 브레이킹과 스탠다드, 라틴 등 각종 댄스 종목을 주관하는 대한체육회 회원 종목 단체다. 투비소프트는 제스처 AI 인식 기술을 토대로 안무저작권 보호를 위한 사업 등으로 창작안무 생태계 조성에 힘쓰고 있다.   이번 협약에 따라 대한민국댄스스포츠연맹은 댄스 콘텐츠와 안무저작권 저변 확대를 위한 파트너십·네트워크 확장 등에 나서며 투비소프트는 안무 인식 AI 기술개발·유통, 안무저작권 보호·활성화를 위한 환경 조성에 협력하기로 했다.   강일성 연맹 회장은 ""댄스스포츠 발전을 위한 다양한 방법을 지속적으로 고민해 국제대회에서 좋은 성적을 거두고 댄스로 소통·화합해 즐기는 문화를 조성하는 데 보탬이 되겠다""고 말했다.   이임찬 투비소프트 사장은 ""이번 협약으로 안무 인식 AI 기술 개발에 박차를 가해 국내 댄스스포츠 산업 발전에 새로운 길을 여는 계기를 만들겠다""고 전했다."
 2022.08.23 14:23,투비소프트 '프로젝트형 넥사크로 N 전문가' 양성과정 2기 모집,"고급 개발인력 양성 목표···9월 2일까지 신청 받아[서울경제] 투비소프트가 UI/UX 플랫폼 대표주자 ‘넥사크로 N’ 전문가를 양성한다.투비소프트(대표이사 이경찬 · 장선수)가 고급 개발자를 배출하기 위한 ‘프로젝트형 넥사크로 N 전문가’ 양성과정 2기 수강생을 모집 중이라고 23일 밝혔다.올해 처음으로 개설한 프로젝트형 넥사크로 N 전문가 양성과정은 ▲넥사크로 N의 체계적인 개발 절차 학습 ▲넥사크로 N으로 UI공통 업무 수행 ▲넥사크로 N 활용 방법 심화 학습에 관심이 있는 개발자를 위해 마련했다.투비소프트가 개발한 '넥사크로'는 정부 · 공공기관, 민간기업 등 5000여 곳에 구축한 UI/UX 플랫폼이다. 지난해 9월 출시한 ‘넥사크로 N’은 로우코드(Low-Code) 플랫폼 기반으로 최소한의 프로그래밍으로 짧은 시간 내 애플리케이션 개발을 구현할 수 있는 특징이 있다.강의는 투비소프트 본사 교육장에서 실시하며, 강사는 투비소프트 제품 교육 담당자가 강의한다.신청 기간은 8월 1일부터 9월 2일까지이며, 교육 일정은 9월 19일부터 12월 13일까지이다. 평일 09시부터 18시까지 주 5일 동안 진행한다. 신청과 문의 등 자세한 사항은 투비소프트 고객지원센터 웹사이트에서 확인할 수 있다."
 2022.08.19 14:04,"'신사업 키운다더니' 투비소프트,  이강테크 인수 1년만에 80% 상각","			 [NFT 및 코인사업은 자회사 사업으로 포장해 자료 배포]투비소프트가 지난해 인수한 복층유리 생산설비 제조업체 이강테크의 지분가치가 1년만에 약 80% 급감한 것으로 나타났다. 19일 투비소프트의 반기보고서에 따르면 이강테크는 반기말 기준 장부금액이 15억3400만원이다. 지난해 6월 70억원에 지분 100%(12만주)를 인수한 지 1년만에 가치가 급감했다. 감사인인 대성삼경회계법인은 지난해 27억5900만원, 상반기 27억원600만원을 손상처리했다.투비소프트는 2020년 11월과 2021년 6월 두차례에 걸쳐 이강테크의 주식을 인수했다. 인수대금은 현금 대신 10회차 전환사채로 지급했다. 회사는 취득 목적에 대해 재무구조 개선 및 유동성 확보라고 밝혔다.하지만 이강테크는 상반기 매출액 11억5500만원, 영업손실 7억6000만원, 당기순손실이 19억2000만원 등 부진한 실적을 기록했다. 이에 따라 투비소프트도 상반기 연결기준 실적이 82억3900만원의 순소실에 머물렀다. 이강테크는 1995년 이강인터내쇼날로 설립된 뒤 2000년 사명을 변경했고, 2007년부터 상장폐지된 기업들과 관계돼 수차례 등장했다. 2010년 상장폐지된 폴켐은 2007년 7월 110억원에 이강테크를 인수했다. 인수 방식은 현금과 전환사채 지급이었다. 하지만 인수 첫 해부터 투비소프트와 비슷하게 손상차손이 발생했고, 상장폐지 이후에는 전액 상각됐다. 강흥섭 이강테크 대표는 폴켐의 최대주주에 오르기도 했다. 지난해 상장폐지된 에이아이비트(현 제이앤케이인더스트리)도 2018년 3월 이강테크의 지분 100%를 120억원에 인수하려 했지만, 10월 인수 계약을 해제했다. 회사는 이강비트의 자산부채 실사를 실시하였으나 신뢰성 있는 회계자료의 미비로 인해 순자산가액을 확정할 수 없어 계약을 해제했다고 공시했다. 증권업계는 투비소프트가 본업인 사용자 인터페이스(UI)·사용자 경험(UX) 플랫폼과 관련이 없는 이강테크를 인수한데 대해 의구심을 나타낸다.  상장폐지된 기업과 관련성이 있고, 수익성이 낮은 기업을 굳이 인수할 필요가 있었냐는 것이다.이에 투비소프트는 ""이강테크의 우수한 기술력을 활용한 매출 증대 등으로 경영정상화 가능성이 높다고 판단했다""며 ""이강테크가 당시 대기업과 사업협력을 논의 중이었고, 현재 관련 계획이 미뤄졌지만 사업가치에 대한 이견이 없다""고 말했다. 이어 ""이강테크의 경영 및 개발환경 개선을 위해 인력 구조조정을 시행했고, 하반기부터 매출 증대를 예상하고 있다""고 덧붙였다. ━NFT 및 코인 사업도  허위 자료 배포…300억원 발행 CB도 사용 못해━투비소프트가 지난해 하반기부터 추진한 신사업 대체불가토큰(NFT)과 가상자산 메타댄스토큰(MDT) 사업도 문제로 지적된다. 회사는 지난해 11월 자회사 투비메타를 설립해 대체불가토큰(NFT) 사업을 추진한다고 밝혔다. 이후 안무 콘텐츠 전문 NFT 거래소 '더봄'을 운영, 메타댄스토큰(MDT)의 가상자산거래소 MECX 상장 등 7개월간 수차례 보도자료를 배포했다. 포털사이트에서 MDT를 검색하면 투비소프트와 관련된 글을 쉽게 찾을 수 있다.하지만 투비메타는 투비소프트와 지분관계가 없다. NFT 및 가상자산 사업 기대감을 높였지만 사실상 투비소프트와 관련이 없는 것이다. 지난해 11월 사업 기대감에 2550원까지 올랐던 투비소프트의 주가는 980원 수준까지 내려왔다. MECX에서 MDT도 올해 5월 상장 이후 0.45달러까지 상승했다가 최근엔 10분의 1 수준인 0.052 달러에 거래되고 있다. 이 같은 문제에 대해 투비소프트는 ""투비소프트와 투비메타가 직접적인 지분 관계는 없지만, 경영진이 중복되고 출자 예정이라 정확히 기술하지 못했다""며 ""최근 투비메타 보도자료에서는 투비소프트 자회사라는 표현이 없다""고 답변했다.  투비소프트는 지난 7월 26일 이사회 결의를 통해 투비메타의 지분 출자를 결의했다. 8월 중 종속기업으로 편입될 예정이다. 증권업계는 투비소프트가 지난해 11월 투자유치한 300억원도 사용하지 못할 만큼 신규사업 발굴에 난항을 겪는다고 보고 있다. 회사는 지난해 11월 메리츠증권을 대상으로 300억원의 전환사채(CB)를 발행했다. 자금 사용 목적은 신규사업자금 240억원, 운영자금 60억원이다.하지만 이 300억원은 사용하지 못한 채 메리츠증권에 근질권이 설정돼 있는 상태다. 메리츠증권은 CB를 발행하면서 사채 조기상환청구에 대한 이행담보로 금융계좌에 대한 근질권설정 계약을 체결했다. 이 자금을 사용하려면 추가 담보를 제공해야 가능하다. 일각에서는 메리츠증권이 자금사용을 위해 추가 담보 제공을 요구한 점을 들어 회사가 매도청구권(콜옵션)을 염두하고 발행한 것이 아니냐는 지적도 나온다.  이 CB는 최초 전환가액이 2250원이지만 시가 하락에 따라 액면가인 500원까지 전환가액 조정이 가능하다. 회사는 이 CB의 콜옵션에 대해 30억원을 파생상품금융자산으로 계상하고 있다. 투비소프트는 ""발행 CB의 조기상환 청구가 11월부터 가능하지만 기업가치 제고로 투자자의 전환권 행사를 위해 노력할 계획""이라며 ""현재 해당 사채에 대한 상환계획은 없다""고 말했다."
 2022.08.01 11:10,"투비소프트, '프로젝트형 넥사크로 N 전문가' 양성과정 2기 모집","[서울=뉴시스] 김경택 기자 = 개발 툴 전문기업 투비소프트는 '프로젝트형 넥사크로 N 전문가' 양성과정 2기 수강생을 모집한다고 1일 밝혔다.투비소프트가 개발한 넥사크로는 정부·공공기관, 민간기업 등 5000여 곳에 구축한 사용자 인터페이스(UI)·사용자 경험(UX) 플랫폼이다. 지난해 9월 출시한 넥사크로 N은 로우 코드(Low-Code) 플랫폼 기반으로 최소한의 프로그래밍으로 짧은 시간 내 애플리케이션 개발을 구현할 수 있는 특징이 있다.이번 교육은 넥사크로 기초 지식부터 프로젝트 진행 과정을 체험할 수 있는 모의 프로젝트까지 다뤄 현업에서 넥사크로 사용을 능숙하게 할 수 있도록 교육과정을 구성했다.수강 대상은 넥사크로 N을 체계적으로 이해하고 UI 공통업무를 수행하려는 개발자다. 장소는 투비소프트 본사 교육장에서 직접 실시할 예정이다.신청 기간은 다음 달 2일까지다. 교육 일정은 9월19일부터 12월13일까지로 평일 9시부터 오후 6시까지 주 5일 동안 진행한다. "
 2022.07.06 16:16,"경찰, ‘업무상 횡령 혐의’ 투비소프트 대표 소환조사","투비소프트 대표, 4일 피의자 신분 출석…조사받아 고발인 “페이퍼컴퍼니로 자금 빼돌려”투비소프트 대표 측 “절차상 문제없어”서울 강남경찰서. [헤럴드경제DB][헤럴드경제=양대근·김희량 기자] 경찰이 업무상 횡령 혐의로 고발된 투비소프트의 이모 대표를 소환 조사한 것으로 확인됐다.6일 헤럴드경제 취재에 따르면 서울 강남경찰서는 지난 4일 투비소프트의 이모 대표를 피의자 신분으로 소환, 조사했다.경찰은 이 대표와 함께 고발된 3명에 대해서도 피의자 신분으로 금명간 불러 조사할 계획으로 알려졌다. 고발된 나머지 3명은 투비소프트의 이모 상근이사, 이 상근이사의 부인인 최모 씨, 이들과 사업파트너인 박모 씨다.금융투자업계 등에 따르면 투비소프트는 농축산물 유통 라이브방송 등 커머스 시스템 구축을 위한 용역을 최씨가 대주주인 A사에 발주하면서 계약금액을 적정가보다 수억원 가량 높은 11억원에 발주한 의혹을 받고 있다.A사의 명의상 대표인 B씨가 이들 4명을 고발했다. B씨는 고발장에서 “이 대표 등 4명은 지난해 8월 페이퍼컴퍼니인 C사를 설립한 뒤 이를 이용해 허위 용역계약을 체결하고 용역대금을 C사에 지불하는 방식으로 자금을 횡령했다”고 주장했다.반면 이 대표 측 법률대리인은 “비교 견적을 다 받았고 관련 절차상 문제가 없었다”면서 “(대표 측에서는) 악의적인 고발 사건으로 판단하고 있고, 경찰 수사에서 성실하게 소명할 것”이라고 반박했다.경찰 관계자는 “(고발당한 다른 3명에 대한 소환 일정 등) 구체적인 수사 내용은 확인이 어렵다”고 밝혔다.코스닥 상장기업인 투비소프트는 지난해부터 경영진을 둘러싼 고소·고발 건이 잇따라 터지면서 홍역을 앓고 있다. 기존 건에 대해서는 2건 각하, 3건 무혐의, 2건의 취하로 올해 초까지 정리가 됐다. 하지만 이번 고발로 다시 리스크에 휘말리게 됐다는 평가가 관련 업계 안팎에서 나온다.투비소프트는 지난해까지 5년 연속 대규모 적자를 기록하는 등 자금난 속에서 각종 신사업에 나서면서 재무구조 개선 압박을 받아왔다. 앞서 자본규모 확충을 위해 무상감자를 시도했으나 정족수 부족으로 무산됐고, 최근 실시한 3자 배정 유상증자의 경우 금액이 당초 공시한 100억원에서 40억원으로 쪼그라든 것으로 알려졌다. 회사 주가도 1년 전과 비교해 반토막이 난 상황이다.　"
 2022.06.30 11:41,"투비소프트, 사외이사에 에디슨EV 조진용 신규 선임",			  [서울=뉴시스] 이승주 기자 = 투비소프트가 삼덕회계법인 출신 조진용 해냄세무회계사무소 대표를 사외이사로 신규 선임했다. 그는 에디슨EV의 사외이사이기도 하다. 이 밖에 정승현 태원보코리아 이사도 사외이사로 신규 선임했다. 임기는 3년이다. 
 2022.06.30 11:40,"투비소프트, 조진용·정승현 사외이사 신규 선임",			 [이데일리 양지윤 기자] 투비소프트(079970)는 사외이사에 조진용 해냄세무회계사무소 대표와 정승현 애니팬고문을 신규 선임했다고 30일 공시했다.
 2022.08.25 09:57,"뷰노, 의료급여 수급권자 대상 환자 지원 프로그램 시행","			 [이데일리 석지헌 기자] 로벌 의료인공지능 솔루션 기업 뷰노(338220)는 의료급여 수급권자에게 AI 기반 심정지 예측 의료기기 뷰노메드 딥카스™를 무상 공급하는 환자 지원 프로그램(Patient Assistance Program; PAP)을 시행한다고 25일 밝혔다.딥카스 운영화면 예시.(사진= 뷰노)뷰노는 ‘환자 중심 헬스케어’를 지향하며, 환자의 소득 수준과 관계없이 누구나 인공지능 의료기술에 대한 접근성을 높임과 동시에 기업의 사회적 책임을 다하기 위해 이번 프로그램을 기획했다. 뷰노메드 딥카스™는 국내 의료AI 업계 최초로 선진입 의료기술로 확정돼 지난 8월 1일 비급여 시장에 진입한 AI 의료기기다. 해당 제품의 24시간 이내 심정지 발생위험 감시 행위는 일반병동 입원환자의 심정지 발생 위험을 조기에 발견해 의료진의 선제적인 조치를 돕는 의료기술이다.해당 의료기술은 일반병동 입원환자라면 질환과 진료과의 구분 없이 누구나 대상자가 될 수 있다. 그러나 법적 고시에 따라 비급여로 환자가 100% 비용을 부담하기 때문에 환자의 소득 수준에 따라 의료기술에 대한 접근성이 제한될 수 있다. 이에 뷰노는 의료급여 수급권자에 대해서는 뷰노메드 딥카스™를 의료기관에 무상으로 공급하기로 결정했다.보건복지부에 따르면 2020년 기준 전체 입원환자 중 의료급여 수급권자는 약 57만명으로 6%[i]에 달한다. 의료급여 수급권자는 종별 구분 없이 입원 시 발생되는 급여 청구액 중 본인부담 비용이 거의 없지만, 비급여 청구액의 경우 100% 부담해야 한다. 또한 의료급여 수급권자의 평균 재원일수는 500병상 이상의 종합병원 기준 10.4일로 의료보험 입원 환자의 평균 재원일수 6.4일에 비해 평균 4일이 더 길어[ii] 입원 시 더 큰 경제적 부담을 느낄 수 있다.이예하 뷰노 대표는 “환자 지원 프로그램은 의료AI 업계 처음으로 시도되는 사회공헌 활동으로, 기업의 사회적 책임을 수행하는 프로그램이라는 점에서 의미가 있다”며 “‘환자 중심 헬스케어’를 지향하는 뷰노의 비전에 따라 앞으로도 더 많은 환자가 AI 의료기술을 체험하고, 누구나 높은 수준의 헬스케어 서비스를 누릴 수 있도록 최선을 다하겠다”고 말했다."
 2022.08.25 09:35,"뷰노, 저소득층에 심정지 예측 AI 무상 서비스","환자 지원 프로그램 시행뷰노메드 딥카스 운영화면 예시 / 사진 제공=뷰노뷰노는 의료급여 수급권자에게 인공지능(AI) 기반 심정지 예측 의료기기 ‘뷰노메드 딥카스’를 무상 서비스하는 환자 지원 프로그램(PAP)을 시행한다고 25일 밝혔다. 의료급여 수급권자는 정부가 사회보장 제도의 일환으로 의료 서비스(진찰, 검사, 치료)를 지원하는 저소득층 등의 대상자다.  환자의 AI 의료기술 접근성을 높이고, 기업의 사회적 책임을 다하기 위해 이번 프로그램을 기획했다는 설명이다.뷰노메드 딥카스는 선진입 의료기술로 확정돼 지난 1일 비급여 시장에 진입했다. 이 제품의 ‘24시간 이내 심정지 발생위험 감시’는 일반병동 입원환자의 심정지 발생 위험을 조기에 발견해 의료진의 선제 조치를 돕는다. 일반병동 입원환자라면 질환 및 진료과와 상관없이 뷰노메드 딥카스 서비스를 활용할 수 있다. 그러나 비급여라 환자가 100% 비용을 부담해야 한다. 이에 뷰노는 뷰노메드 딥카스를 의료기관에 무상으로 공급하고 의료급여 수급권자에 무료로 사용할 수 있게 한다는 계획이다. 보건복지부에 따르면 2020년 기준 국내 의료급여 수급권자는 약 57만명으로 전체 입원 환자의 6%다. 500병상 이상 종합병원 기준 이들 수급권자의 평균 재원(在院)일수는 10.4일로 의료보험 입원 환자의 6.4일보다 4일이 더 길다. 의료급여 수급권자라 해도 비급여 청구액은 100% 부담해야 한다.이예하 뷰노 대표는 “이번 지원 프로그램은 의료AI 업계 최초로 시도되는 사회공헌 활동”이라며 “앞으로도 더 많은 환자가 AI 의료기술을 체험하고 높은 수준의 헬스케어 서비스를 누릴 수 있도록 하겠다”고 말했다."
