날짜,제목,내용
 2023.05.16 17:40,"루닛, MSCI 글로벌 스몰캡 지수 신규 편입","패시브펀드 등 외국인 자본 유입 기대 루닛의료 인공지능(AI) 기업 루닛은 모건스탠리 캐피털인터내셔널(MSCI) 글로벌 스몰캡(소형주) 지수에 새로 편입됐다고 16일 밝혔다.MSCI는 미국 투자은행 모건스탠리의 자회사 모건스탠리 캐피털인터내셔널에서 발표하는 지수다. 전 세계를 대상으로 하는 글로벌 펀드의 주요지표로 추종되고 있어 영향력이 크다.MSCI는 매년 2월, 5월, 8월, 11월마다 분야별 구성종목의 편출입을 발표하고 있다. 이달 발표한 글로벌 스몰캡 분야에는 루닛을 포함 총 31개 국내 기업이 신규 편입됐다.루닛은 올해 초 생성형 인공지능 챗GPT의 부상과 함께 의료AI 분야가 주목을 받으며 시가총액이 꾸준히 증가했다. 특히 올해 1분기 분기 사상 최대이자 전년동기 대비 269% 증가한 110억원의 매출을 기록하는 등 가파른 성장세를 보이고 있다.서범석 루닛 대표는 “특정 지수의 구성종목에 투자하는 여러 패시브 펀드(Passive Fund)가 MSCI 지수를 추종하는 만큼, 이번 MSCI 지수 편입을 통한 투자금 유입은 향후 주가 흐름에 긍정적으로 작용할 전망”이라고 말했다."
 2023.05.16 17:27,"루닛, MSCI 글로벌 스몰캡 지수 신규 편입 배경은","주요 제품의 해외 매출 앞세워 고성장1분기 매출, 지난해 전체 매출 80% 육박의료 인공지능(AI) 기업 루닛이 가파른 성장세를 보이고 있다. 주요 제품의 해외 판매를 중심으로 외형을 빠르게 키우는 모습이다.루닛은 모건스탠리캐피털인터내셔널(MSCI) 글로벌 스몰캡(소형주) 지수에 새로 편입됐다고 16일 밝혔다.MSCI는 미국 투자은행 모건스탠리의 자회사 모건스탠리캐피털인터내셔널에서 발표하는 지수로, 국제금융 펀드의 투자 기준이 되는 대표적인 지표다. 전 세계를 대상으로 하는 글로벌 펀드의 주요지표로 추종되고 있어 영향력이 크다.MSCI는 매년 2월, 5월, 8월, 11월마다 분야별 구성종목의 편출입을 발표한다. MSCI 지수에 편입되기 위해서는 일정 시가총액과 유동 시가총액을 넘겨야 한다. 이달 발표한 글로벌 스몰캡 분야에는 루닛을 포함 총 31개 국내 기업이 신규 편입됐다.2013년 설립된 루닛은 국내 최초의 딥러닝* AI 기업이다. AI 기술을 기반으로 질병의 진단과 치료 솔루션을 개발하고 제공한다. 루닛의 시가총액은 올해 초 미국 생성형 AI '챗GPT'가 떠오르면서 꾸준히 증가했다. 지난해 10월 1만8000원대였던 루닛 주가는 16일 종가 기준 7만2900원을 기록했다.*딥러닝: 컴퓨터가 외부 데이터를 조합, 분석해 스스로 학습하는 기술. 데이터 속에서 패턴을 발견한 뒤 사물을 구분하는 인간 두뇌의 정보처리 방식을 모방해 기존 인공신경망의 한계를 극복했다는 평가를 받음루닛 실적. /그래픽=비즈워치특히 회사는 주요 제품의 해외 판매를 중심으로 외형을 빠르게 확장 중이다. 금융감독원 전자공시에 따르면 루닛은 올 1분기 연결기준 매출 110억원을 올렸다. 이는 분기 사상 최대 매출로, 전년보다 267% 증가한 수치다. 지난해 연 매출 138억원의 80%에 달하는 매출을 1분기 만에 달성한 것이기도 하다.루닛은 후지필름, 가던트헬스, 인디카랩스 등 글로벌 헬스케어 기업과 손잡고 해외 시장 공략에 속도를 내고 있다. 지난 3월 말 기준 루닛 인사이트 제품을 사용하는 의료기관은 전 세계 2000곳을 돌파했다. 올 1분기 루닛 인사이트 제품, 루닛 스코프 등을 포함한 수출 실적은 1분기 매출의 80%에 해당하는 97억원이었다.루닛은 이번 지수 편입을 발판 삼아 더욱 공격적인 투자에 나설 전망이다. 회사는 올 1분기에만 유럽 자회사 '루닛 유럽 홀딩스'를 설립한 데 이어 미국 자회사 '루닛 USA'에 37억원의 유상증자를 실시하는 등 활발한 투자 활동을 펼치고 있다.서범석 루닛 대표는 ""특정 지수의 구성 종목에 투자하는 여러 패시브 펀드(Passive Fund)가 MSCI 지수를 추종하는 만큼, 이번 MSCI 지수 편입을 통한 투자금 유입은 향후 주가 흐름에 긍정적으로 작용할 전망""이라고 했다."
 2023.05.16 14:00,"루닛, MSCI 글로벌 스몰캡 지수 신규 편입…“외국인 자본 유입 기대”","국내 기업 31곳 지수 포함루닛이 모건 스탠리 캐피털 인터내셔널(MSCI) 글로벌 스몰캡(소형주) 지수에 새롭게 편입됐다. [사진 루닛][이코노미스트 선모은 기자] 루닛은 모건 스탠리 캐피털 인터내셔널(MSCI) 글로벌 스몰캡(소형주) 지수에 새롭게 편입됐다고 16일 밝혔다.MSCI는 미국의 투자은행인 모건 스탠리의 자회사인 모건 스탠리 캐피털 인터내셔널이 발표하는 지수다. 국제금융 펀드의 투자 기준이 되는 주요 지표다.모건 스탠리 캐피털 인터내셔널은 매년 2월과 5월, 8월, 11월에 분야별 구성 종목의 편·출입을 발표한다. 이달 발표한 글로벌 스몰캡 분야에는 루닛을 비롯한 31개 국내 기업이 신규 편입됐다.루닛은 올해 1분기 연결기준 110억원의 매출을 기록했다. 전년 동기 대비 269% 증가한 수치다. 영업손실은 24억원이다. 지난해 1분기에 이어 올해도 1분기 적자를 지속했다.서범석 루닛 대표는 “여러 패시브 펀드가 MSCI 지수를 추종하는 만큼 이번 지수 편입을 통해 투자금이 유입돼 향후 주가 흐름에 긍정적으로 작용할 것으로 기대된다”고 했다."
 2023.05.16 09:09,"루닛, MSCI 글로벌 스몰캡 지수 신규편입…""외자 유입 기대""","			 의료 인공지능(AI) 기업 루닛은 모건스탠리캐피털인터내셔널(MSCI) 글로벌 스몰캡(소형주) 지수에 신규 편입됐다고 16일 밝혔다.루닛 사이니지. [사진제공=루닛]MSCI는 미국 투자은행 모건스탠리의 자회사 모건스탠리 캐피털인터내셔널에서 발표하는 지수로, 국제금융 펀드의 투자 기준이 되는 대표적인 지표다. 특히 전 세계를 대상으로 하는 글로벌 펀드의 주요 지표로 추종되고 있어 영향력이 크다.MSCI는 매년 2월, 5월, 8월, 11월마다 분야별 구성종목의 편출입을 발표하고 있다. 이달 발표한 글로벌 스몰캡 분야에는 루닛을 포함 총 31개 국내 기업이 신규 편입됐다.루닛은 올해 초 생성형 인공지능 챗GPT의 부상과 함께 의료 AI 분야가 주목을 받으며 시가총액이 꾸준히 증가했다. 올해 1분기에는 분기 사상 최대이자 전년 동기 대비 269% 증가한 110억원의 매출을 기록했다.서범석 루닛 대표는 ""특정 지수의 구성 종목에 투자하는 여러 패시브 펀드가 MSCI 지수를 추종하는 만큼 이번 MSCI 지수 편입을 통한 투자금 유입은 향후 주가 흐름에 긍정적으로 작용할 전망""이라고 말했다."
 2023.05.16 08:55,"루닛, MSCI 글로벌 스몰캡 지수 신규 편입","""외국인 자금 유입 기대""루닛은 모건스탠리캐피털인터내셔널(MSCI) 글로벌 스몰캡(소형주) 지수에 신규 편입됐다고 16일 밝혔다.MSCI는 미국 투자은행 모건스탠리의 자회사 모건스탠리캐피털인터내셔널이 발표하는 지수다. 국제금융 펀드의 투자 기준이 되는 주요 지표다. 매년 2·5·8·11월마다 분야별 구성 종목의 편·출입을 발표한다. 이달 발표한 글로벌 스몰캡 분야에는 루닛을 포함한 31개 국내 기업이 새로 편입됐다.루닛은 올해 1분기에 분기 최대이자, 전년 동기 대비 269% 증가한 110억원의 매출을 기록하는 등 성장세를 보이고 있다고 했다.서범석 루닛 대표는 “특정 지수의 구성종목에 투자하는 여러 패시브 펀드(Passive Fund)가 MSCI 지수를 추종하는 만큼, 이번 MSCI 지수 편입을 통한 투자금 유입은 주가 흐름에 긍정적으로 작용할 것”이라고 말했다."
 2023.05.16 08:32,"루닛, MSCI 글로벌 스몰캡 지수 신규 편입…외인 자본 유입 기대감 ↑","국제금융 펀드 투자 기준되는 대표적 지표…총 31개 국내사 신규 편입루닛은 모건스탠리 캐피털인터내셔널(MSCI) 글로벌 스몰캡(소형주) 지수에 새로 편입됐다고 16일 밝혔다.MSCI는 미국 투자은행 모건스탠리의 자회사 모건스탠리 캐피털인터내셔널에서 발표하는 지수다. 국제금융 펀드의 투자 기준이 되는 대표적인 지표다. 특히 전 세계를 대상으로 하는 글로벌 펀드의 주요지표로 추종돼 영향력이 크다.MSCI는 매년 2월, 5월, 8월, 11월마다 분야별 구성종목의 편출입을 발표하고 있다. 이달 발표한 글로벌 스몰캡 분야에는 루닛을 포함 총 31개 국내 기업이 신규 편입됐다.루닛은 올해 초 생성형 인공지능 챗GPT의 부상과 함께 의료AI 분야가 주목을 받으며 시가총액이 꾸준히 증가했다. 특히 1분기에는 분기 사상 최대인 동시에 전년 동기 대비 269% 증가한 110억원의 매출을 기록하는 등 가파른 성장세를 보이고 있다.서범석 루닛 대표는 ""특정 지수의 구성종목에 투자하는 여러 패시브 펀드(Passive Fund)가 MSCI 지수를 추종하는 만큼, 이번 MSCI 지수 편입을 통한 투자금 유입은 향후 주가 흐름에 긍정적으로 작용할 전망""이라고 말했다."
 2023.05.15 13:10,루닛 '의료 AI 솔루션' 해외 軍병원으로 확대,"서범석 루닛 대표. 김병준 기자[서울경제] 의료 인공지능(AI) 기업 루닛이 해외 파병군과 격오지 부대 의료기관으로 AI 솔루션 시범 도입을 확대한다.15일 관련업계에 따르면 루닛은 최근 과학기술정보통신부 및 정보통신산업진흥원(NIPA)과 ‘AI융합 의료영상 진료판독 시스템 사업’ 4차년도 사업 진행을 위한 협약을 맺었다. 흉부 엑스레이 AI 영상분석 솔루션 ‘루닛 인사이트 CXR’을 공급한다.루닛은 지난해 3차년도 사업에서 국군의무사령부, 국군수도병원 등 육·해·공 군 의료기관에 루닛 인사이트 CXR을 시범 도입해 우수한 평가를 받았다. 4차년도 사업에서는 국내 군 병원 외에 해외 군 병원 및 한국 파병부대 등으로 솔루션 제공 범위를 확대한다. 특히 해군 선박 등 의료 인프라가 취약한 격오지 부대의 의료환경 개선에 힘 쓸 방침이다. 휴대용 엑스레이 촬영장비와 연동된 맞춤형 AI 솔루션을 개발하고 안정적 활용 체계를 구축하는 등 접근성을 크게 높일 계획이다.서범석 루닛 대표는 “올해는 국내에서 입증된 루닛의 군의료 AI서비스가 해외 군 병원 및 파병부대에 도입되는 첫 해”라며 “군 의료기관 뿐 아니라 전국 보건소 등을 대상으로 하는 의료 AI 서비스 확산과 공공의료 인프라 강화에도 박차를 가할 것”이라고 밝혔다."
 2023.05.15 09:22,"루닛, 의료 AI 솔루션 해외 군 병원에 시범도입 확대","의료 취약 해외 파병부대에 루닛 인사이트 공급맞춤형 솔루션 개발 및 구축으로 군 의료환경 선진화 지원루닛 인사이트 CXR.(사진=루닛)[이데일리 송영두 기자] 의료 인공지능(AI) 기업 루닛은 해외 파병군 및 격오지 부대 의료기관에 AI 솔루션 시범도입을 확대한다고 15일 밝혔다. 이를 통해 군 의료환경 개선을 가속화하겠다는 방침이다.루닛(328130)은 최근 과학기술정보통신부 및 정보통신산업진흥원(NIPA)과 ‘AI융합 의료영상 진료판독시스템 사업’ 4차년도 과업 진행을 위한 협약을 맺고, 흉부 엑스레이 AI 영상분석 솔루션 ’루닛 인사이트 CXR‘을 공급하기로 협의했다.회사는 지난해 3차년도 사업에서 국군의무사령부, 국군수도병원 등 육·해·공 군 의료기관에 루닛 인사이트 CXR을 시범도입, 우수한 평가를 받으며 이번 사업 추진의 교두보를 마련했다.올해 4차년도 사업에서는 국내 군 병원 외에 해외 군 병원 및 한국 파병부대 등으로 솔루션 제공 범위를 확대할 예정이다. 특히 해군 선박 등 의료 인프라가 취약한 격오지 부대의 의료환경 개선에 더욱 힘쓸 예정이다. 이를 위해 휴대용 엑스레이 촬영장비와 연동된 맞춤형 AI 솔루션을 개발하고 안정적 활용 체계를 구축하는 등 접근성을 크게 높일 방침이다.서범석 루닛 대표는 “루닛은 정부의 인공지능 융합(AI+X) 사업 참여를 통해 의료 AI가 군 병원 진료 효율성을 향상시키고 양질의 의료 서비스 제공에 기여할 수 있음을 입증해오고 있다”며 “올해는 국내에서 입증된 루닛의 군의료 AI서비스가 해외 군 병원 및 파병부대에 도입되는 첫 해이다. 향후에는 군 의료기관뿐 아니라 전국 보건소 등을 대상으로 하는 의료AI 서비스 확산과 공공의료 인프라 강화에도 더욱 박차를 가할 것”이라고 말했다.루닛은 해당 사업에 지난 2020년부터 바스젠바이오와 컨소시엄을 구성해 참여해오고 있다. 컨소시엄 주관기업인 루닛은 사업 총괄 및 루닛 인사이트 CXR 공급 등을 담당하고, 바스젠바이오는 근골격계 골절질환 AI 솔루션을 제공하고 있다."
 2023.05.15 08:49,"루닛, 해외 軍 병원 의료 AI 솔루션 시범도입 확대","해외 파병부대 등에 흉부 엑스레이 AI 영상분석 솔루션 공급맞춤형 솔루션 개발 및 안정적 활용 체계 구축…군 의료환경 선진화 지원루닛 흉부 엑스레이 AI 영상분석 솔루션 '루닛 인사이트 CXR' /사진=루닛루닛은 군 의료환경 선진화를 위해 해외 파병군 및 격오지 부대 의료기관으로 인공지능(AI) 솔루션 시범도입을 확대한다고 15일 밝혔다.루닛은 최근 과학기술정보통신부 및 정보통신산업진흥원(NIPA)과 'AI융합 의료영상 진료판독시스템 사업' 4차년도 과업 진행을 위한 협약을 맺고, 흉부 엑스레이 AI 영상분석 솔루션 '루닛 인사이트 CXR'을 공급하기로 협의했다.앞서 루닛은 지난해 국군의무사령부, 국군수도병원 등 육·해·공 군 의료기관에 루닛 인사이트 CXR을 시범 도입해 우수한 평가를 받으며 이번 사업 추진 교두보를 마련한 바 있다.이를 바탕으로 올해 사업에서는 국내 군 병원 외에 해외 군 병원 및 한국 파병부대 등으로 솔루션 제공 범위를 확대할 예정이다. 특히, 해군 선박 등 의료 인프라가 취약한 격오지 부대의 의료환경 개선에 더욱 힘쓸 예정이다. 이를 위해 휴대용 엑스레이 촬영장비와 연동된 맞춤형 AI 솔루션을 개발하고 안정적 활용 체계를 구축하는 등 접근성을 크게 높일 계획이다. 서범석 루닛 대표는 ""정부 인공지능 융합(AI+X) 사업 참여를 통해 의료 AI가 군 병원 진료 효율성을 향상시키고 양질의 의료 서비스 제공에 기여할 수 있음을 입증해오고 있다""며 ""올해는 국내에서 입증된 루닛의 군의료 AI서비스가 해외 군 병원 및 파병부대에 도입되는 첫 해다. 향후 군 의료기관뿐 아니라 전국 보건소 등을 대상으로 하는 의료AI 서비스 확산과 공공의료 인프라 강화에도 더욱 박차를 가할 것""이라고 말했다.루닛은 해당 사업에 지난 2020년부터 바스젠바이오와 컨소시엄을 구성해 참여해오고 있다. 컨소시엄 주관기업인 루닛은 사업 총괄 및 루닛 인사이트 CXR 공급 등을 담당하고, 바스젠바이오는 근골격계 골절질환 AI 솔루션을 제공하고 있다."
 2023.05.15 08:26,"루닛, 해외 군 병원으로 의료 AI 솔루션 시범도입 확대","해외 파병부대 등에 공급루닛은 군 의료환경 선진화를 위해 해외 파병군 및 격오지 부대 의료기관으로 인공지능(AI) 솔루션의 시범도입을 확대한다고 15일 밝혔다.루닛은 과학기술정보통신부 및 정보통신산업진흥원과 'AI융합 의료영상 진료판독시스템 사업' 4차년도 진행을 위한 협약을 맺었다. 흉부 엑스레이 AI 영상분석 솔루션 '루닛 인사이트 CXR'의 공급을 협의했다.회사는 지난해 3차년도 사업에서 국군의무사령부와 국군수도병원 등 육해공 군 의료기관에 루닛 인사이트 CXR을 공급했다. 이를 바탕으로 올해 4차년도 사업에서는 국내 군 병원 외에 해외 군 병원 및 한국 파병부대 등으로 솔루션 제공 범위를 확대할 예정이라고 했다. 특히 해군 선박 등 의료 기반(인프라)이 취약한 격오지 부대의 의료환경 개선에 더욱 힘쓸 것이라고 전했다. 이를 위해 휴대용 엑스레이 촬영장비와 연동된 맞춤형 AI 솔루션을 개발하고, 활용 체계를 구축하는 등 접근성을 높일 방침이다.서범석 루닛 대표는 ""올해는 루닛의 군 의료 AI 서비스가 해외 군 병원 및 파병부대에 도입되는 첫 해""라며 ""향후에는 군 의료기관뿐 아니라, 전국 보건소 등을 대상으로 하는 의료 AI 서비스 확산과 공공의료 인프라 강화에도 박차를 가할 것""이라고 말했다.루닛은 이번 사업에 2020년부터 바스젠바이오와 콘소시엄을 구성해 참여하고 있다. 주관 기업인 루닛은 사업 총괄 및 루닛 인사이트 CXR 공급 등을 담당하고, 바스젠바이오는 근골격계 골절질환 AI 솔루션을 제공 중이다. "
 2023.05.15 08:24,"루닛, 해외 軍병원에 AI솔루션 시범도입…""의료환경 선진화""","해외 파병부대에 '루닛 인사이트 CXR' 공급의료 인공지능(AI) 기업 루닛은 군 의료환경 선진화를 위해 해외 파병군 및 격오지 부대 의료기관으로 AI 솔루션 시범 도입을 확대한다고 15일 밝혔다.루닛의 흉부 엑스레이 AI 영상분석 솔루션 '루닛 인사이트 CXR'. [사진제공=루닛]루닛은 최근 과학기술정보통신부 및 정보통신산업진흥원(NIPA)과 'AI융합 의료영상 진료판독시스템 사업' 4차년도 과업 진행을 위한 협약을 맺고 흉부 엑스레이 AI 영상분석 솔루션 '루닛 인사이트 CXR'을 공급하기로 협의했다.루닛은 앞서 지난해 3차년도 사업에서 국군의무사령부, 국군수도병원 등 육·해·공 군 의료기관에 루닛 인사이트 CXR을 시범 도입한 바 있다. 이를 바탕으로 올해 4차년도 사업에서는 국내 군 병원 외에 해외 군 병원 및 한국 파병부대 등으로 솔루션 제공 범위를 확대할 예정이다.특히 해군 선박 등 의료 인프라가 취약한 격오지 부대의 의료환경 개선에 힘을 쏟을 예정이다. 이를 위해 휴대용 엑스레이 촬영장비와 연동된 맞춤형 AI 솔루션을 개발하고 안정적 활용 체계를 구축한다.서범석 루닛 대표는 ""올해는 국내에서 입증된 루닛의 군 의료 AI서비스가 해외 군 병원 및 파병부대에 도입되는 첫해""라며 ""향후에는 군 의료기관뿐 아니라 전국 보건소 등을 대상으로 하는 의료AI 서비스 확산과 공공의료 인프라 강화에도 더욱 박차를 가할 것""이라고 말했다.루닛은 2020년부터 바스젠바이오와 컨소시엄을 구성해 해당 사업에 참여해오고 있다. 컨소시엄 주관기업인 루닛은 사업 총괄 및 루닛 인사이트 CXR 공급 등을 담당하고, 바스젠바이오는 근골격계 골절질환 AI 솔루션을 제공하고 있다."
